{
  "version": "v0.1",
  "service_id": "thedivineparadox",
  "role_id": "interaction-orchestration-cell",
  "proposal_id": "tdp.uiux.interaction-parity-package.2026-03-01",
  "output_kind": "interaction-flow-spec",
  "state_refs": [
    "Attuning",
    "Offering",
    "JudgementBloom"
  ],
  "intent_ref": "tdp-uiux-orchestration-2026-03-01",
  "trace_ref": null,
  "policy_refs": [
    "policies/approval_tier_policy.v0.1.json",
    "control/specs/trace_rules.v0.1.json"
  ],
  "evidence_refs": [
    "experience-contract:test-scenarios:gesture-parity",
    "experience-contract:interaction-ritual:input-channels"
  ],
  "change_summary": [
    "Map pointer, touch, and bounded motion gestures to the same semantic ritual channels.",
    "Preserve one-cycle feedback for successful and mistimed input during the voting arc."
  ],
  "acceptance_checks": [
    "Core ritual semantics should remain legible on both PC pointer input and mobile touch or motion input.",
    "Swipe, pinch, long press, and tilt should map to bounded semantic channels without adding extra hidden states."
  ]
}
