{
  "version": "v0.1",
  "service_id": "thedivineparadox",
  "role_id": "policy-safety-cell",
  "proposal_id": "tdp.uiux.governance-release-check.2026-03-01",
  "output_kind": "policy-verdict-note",
  "state_refs": [
    "Revelation",
    "Afterglow"
  ],
  "intent_ref": "tdp-uiux-orchestration-2026-03-01",
  "trace_ref": null,
  "policy_refs": [
    "policies/agent_routing_policy.v0.1.json",
    "policies/approval_tier_policy.v0.1.json",
    "policies/policy_profiles.v0.1.json"
  ],
  "evidence_refs": [
    "agent-roles:proposal-packets:ritual-legibility-baseline",
    "agent-roles:proposal-packets:interaction-parity-package",
    "agent-roles:proposal-packets:visual-differentiation-pass"
  ],
  "change_summary": [
    "Confirm each proposal remains inside the declared service boundary and uses only approved policy references.",
    "Hold any runtime-bound or high-tier expansion until the human architect gate is explicitly satisfied."
  ],
  "acceptance_checks": [
    "Every final package must retain intent, policy, and evidence linkage.",
    "High-tier changes must remain held until the human gate is satisfied."
  ]
}
