{
  "version": "v0.1",
  "service_id": "thedivineparadox",
  "role_id": "visual-systems-cell",
  "proposal_id": "tdp.uiux.visual-differentiation-pass.2026-03-01",
  "output_kind": "visual-modulation-brief",
  "state_refs": [
    "JudgementBloom",
    "Revelation",
    "Afterglow"
  ],
  "intent_ref": "tdp-uiux-orchestration-2026-03-01",
  "trace_ref": null,
  "policy_refs": [
    "services/thedivineparadox/policy.profile.json",
    "control/specs/trace_rules.v0.1.json"
  ],
  "evidence_refs": [
    "experience-contract:visual-modulation-contract",
    "experience-contract:test-scenarios:emotion-differentiation",
    "experience-contract:test-scenarios:rendering-budget"
  ],
  "change_summary": [
    "Increase state-level visual separation between JudgementBloom, Revelation, and Afterglow using existing modulation fields.",
    "Keep the rendering budget bounded by degrading particles and postprocess intensity first on constrained devices."
  ],
  "acceptance_checks": [
    "Each phase should remain visually distinguishable from a single screenshot.",
    "Theme transitions should not cause severe frame drops on mid-tier GPUs."
  ]
}
