{
  "version": "v0.1",
  "service_id": "thedivineparadox",
  "role_id": "ux-research-cell",
  "proposal_id": "tdp.uiux.ritual-legibility-baseline.2026-03-01",
  "output_kind": "ui-ux-evidence-brief",
  "state_refs": [
    "Dormant",
    "Awakening",
    "Attuning"
  ],
  "intent_ref": "tdp-uiux-orchestration-2026-03-01",
  "trace_ref": null,
  "policy_refs": [
    "policies/approval_tier_policy.v0.1.json",
    "services/thedivineparadox/policy.profile.json"
  ],
  "evidence_refs": [
    "experience-contract:test-scenarios:interaction-legibility",
    "experience-contract:interaction-ritual:state-machine"
  ],
  "change_summary": [
    "Define first-session friction markers for the entry loop spanning Dormant through Attuning.",
    "Prioritize clear invocation affordances before introducing emotional variation."
  ],
  "acceptance_checks": [
    "A first-time user should infer the ritual action within the first 10 seconds.",
    "Narrative framing must preserve the current contract boundary and passive fallback."
  ]
}
